name;category;subcategory;price;pack_size;composition;frequency;appl_method;plants;supplier;manufacturer;product_description;product_in_stock
All-Purpose Fertilizer;Fertilizers;Granular;14.99;5kg;NPK 10-10-10;Monthly;Sprinkle;All plants;Global Supplies Inc;Green Machines Co.;Balanced fertilizer for general use;500
Cactus Mix Fertilizer;Fertilizers;Specialized;15.99;3kg;NPK 5-5-10;Every 3 months;Spray;Succulents;Logistics Pro GmbH;Green Machines Co.;Ideal for cactus and succulent care;300
Flower Booster;Fertilizers;Liquid;15.99;1L;NPK 15-30-15;Biweekly;Drenching;Flowering plants;Global Supplies Inc;Textile Corp S.p.A;Liquid fertilizer for vibrant blooms;250
Organic Compost;Fertilizers;Organic;15.00;10kg;Decomposed organic matter;Annually;Spread evenly;Outdoor plants;Logistics Pro GmbH;Textile Corp S.p.A;Nutrient-rich compost for outdoor gardens;150
Palm Tree Fertilizer;Fertilizers;Specialized;22.00;2kg;NPK 8-12-15;Monthly;Sprinkle;Palm trees;Global Supplies Inc;Green Machines Co.;Specially formulated for healthy palms;200
