name;category;subcategory;price;material;size;color;decorative_features;drainage;supplier;manufacturer;product_description;product_in_stock
Terracotta Pot;Plant Container;Indoor;14.90;Terracotta;24;Orange;Classic design;Yes;Global Supplies Inc;Green Machines Co.;Ideal for indoor plants with natural drainage;200
Ceramic Planter;Plant Container;Outdoor;25.50;Ceramic;15;White;Textured finish;Yes;Logistics Pro GmbH;Textile Corp S.p.A;Modern ceramic planter for patios;150
Hanging Basket;Plant Container;Indoor;18.75;Plastic;24;Black;Macrame holder;No;Global Supplies Inc;Green Machines Co.;Stylish hanging basket for indoor decor;120
Metal Trough;Plant Container;Outdoor;35.00;Galvanized Metal;11;Silver;Industrial look;Yes;Logistics Pro GmbH;Green Machines Co.;Durable trough for outdoor garden arrangements;100
Self-Watering Pot;Plant Container;Indoor;30.99;Plastic;11;Gray;Smart water reservoir;No;Global Supplies Inc;Textile Corp S.p.A;Innovative self-watering pot for busy gardeners;80
